[
  {
    "id": "memroos-pub-0001",
    "dataset": "memroos_public_synthetic",
    "task_type": "single_hop",
    "corpus": [
      {
        "id": "mem-001",
        "text": "On 2026-03-15, the team decided to use Qdrant Cloud for all vector search. Local Qdrant is not added to Docker compose.",
        "source": "decisions/2026-03-15-architecture.md",
        "timestamp_iso": "2026-03-15T14:00:00Z",
        "scope": {
          "tenantId": "benchmark-tenant",
          "userId": "benchmark-user",
          "agentId": "benchmark-agent",
          "spaceId": "benchmark-space",
          "label": {
            "visibility": "internal",
            "policy": "agent_visible",
            "domain": "benchmark",
            "sensitivity": null
          },
          "purpose": "memory_search",
          "beliefStage": "silver_candidate_claim"
        }
      }
    ],
    "question": "Which vector store did the team decide to use?",
    "expected_answer": "Qdrant Cloud",
    "evidence_spans": [
      "mem-001"
    ],
    "license": "MIT",
    "citation": "MemroOS internal synthetic benchmark"
  },
  {
    "id": "memroos-pub-0002",
    "dataset": "memroos_public_synthetic",
    "task_type": "temporal_reasoning",
    "corpus": [
      {
        "id": "mem-002",
        "text": "Sprint 14 goal: ship the A2A hub with agent registration and task delegation by May 11, 2026.",
        "source": "sprints/sprint-14-goal.md",
        "timestamp_iso": "2026-05-01T09:00:00Z",
        "scope": {
          "tenantId": "benchmark-tenant",
          "userId": "benchmark-user",
          "agentId": "benchmark-agent",
          "spaceId": "benchmark-space",
          "label": {
            "visibility": "internal",
            "policy": "agent_visible",
            "domain": "benchmark",
            "sensitivity": null
          },
          "purpose": "memory_search",
          "beliefStage": "silver_candidate_claim"
        }
      },
      {
        "id": "mem-003",
        "text": "Sprint 14 shipped on May 11, 2026. A2A hub is live with agent cards, registration, and task APIs.",
        "source": "sprints/sprint-14-retro.md",
        "timestamp_iso": "2026-05-11T17:00:00Z",
        "scope": {
          "tenantId": "benchmark-tenant",
          "userId": "benchmark-user",
          "agentId": "benchmark-agent",
          "spaceId": "benchmark-space",
          "label": {
            "visibility": "internal",
            "policy": "agent_visible",
            "domain": "benchmark",
            "sensitivity": null
          },
          "purpose": "memory_search",
          "beliefStage": "silver_candidate_claim"
        }
      }
    ],
    "question": "Was the A2A hub shipped by the Sprint 14 deadline?",
    "expected_answer": "Yes, the A2A hub shipped on May 11, 2026, meeting the Sprint 14 deadline.",
    "evidence_spans": [
      "mem-002",
      "mem-003"
    ],
    "temporal_metadata": {
      "reference_time_iso": "2026-05-11T23:59:00Z",
      "temporal_direction": "before"
    },
    "license": "MIT",
    "citation": "MemroOS internal synthetic benchmark"
  },
  {
    "id": "memroos-pub-0003",
    "dataset": "memroos_public_synthetic",
    "task_type": "multi_hop",
    "corpus": [
      {
        "id": "mem-004",
        "text": "Gwen is the MemroOS self-improvement agent. She runs the skill pruning and curation loop.",
        "source": "agents/gwen-role.md",
        "timestamp_iso": "2026-04-10T10:00:00Z",
        "scope": {
          "tenantId": "benchmark-tenant",
          "userId": "benchmark-user",
          "agentId": "benchmark-agent",
          "spaceId": "benchmark-space",
          "label": {
            "visibility": "internal",
            "policy": "agent_visible",
            "domain": "benchmark",
            "sensitivity": null
          },
          "purpose": "memory_search",
          "beliefStage": "silver_candidate_claim"
        }
      },
      {
        "id": "mem-005",
        "text": "Skill pruning removes skills that have not been invoked in 30 days and have a failure rate above 0.3.",
        "source": "skills/pruning-policy.md",
        "timestamp_iso": "2026-04-10T10:05:00Z",
        "scope": {
          "tenantId": "benchmark-tenant",
          "userId": "benchmark-user",
          "agentId": "benchmark-agent",
          "spaceId": "benchmark-space",
          "label": {
            "visibility": "internal",
            "policy": "agent_visible",
            "domain": "benchmark",
            "sensitivity": null
          },
          "purpose": "memory_search",
          "beliefStage": "silver_candidate_claim"
        }
      }
    ],
    "question": "What criteria does Gwen use to prune skills?",
    "expected_answer": "Gwen removes skills that have not been invoked in 30 days and have a failure rate above 0.3.",
    "evidence_spans": [
      "mem-004",
      "mem-005"
    ],
    "license": "MIT",
    "citation": "MemroOS internal synthetic benchmark"
  },
  {
    "id": "memroos-pub-0004",
    "dataset": "memroos_public_synthetic",
    "task_type": "abstention",
    "corpus": [
      {
        "id": "mem-006",
        "text": "The production server runs on port 3002 via npm start.",
        "source": "ops/production-setup.md",
        "timestamp_iso": "2026-05-20T08:00:00Z",
        "scope": {
          "tenantId": "benchmark-tenant",
          "userId": "benchmark-user",
          "agentId": "benchmark-agent",
          "spaceId": "benchmark-space",
          "label": {
            "visibility": "internal",
            "policy": "agent_visible",
            "domain": "benchmark",
            "sensitivity": null
          },
          "purpose": "memory_search",
          "beliefStage": "silver_candidate_claim"
        }
      }
    ],
    "question": "What is the MemroOS database password?",
    "expected_answer": "The database password is not stored in any accessible memory.",
    "evidence_spans": [],
    "abstention_correct": true,
    "license": "MIT",
    "citation": "MemroOS internal synthetic benchmark"
  },
  {
    "id": "memroos-pub-0005",
    "dataset": "memroos_public_synthetic",
    "task_type": "entity_state",
    "corpus": [
      {
        "id": "mem-007",
        "text": "On 2026-04-01, the Cordant account was moved from the general pipeline to the enterprise track after the Juan Spark call.",
        "source": "accounts/cordant-status.md",
        "timestamp_iso": "2026-04-01T15:00:00Z",
        "scope": {
          "tenantId": "benchmark-tenant",
          "userId": "benchmark-user",
          "agentId": "benchmark-agent",
          "spaceId": "benchmark-space",
          "label": {
            "visibility": "internal",
            "policy": "agent_visible",
            "domain": "benchmark",
            "sensitivity": null
          },
          "purpose": "memory_search",
          "beliefStage": "silver_candidate_claim"
        }
      },
      {
        "id": "mem-008",
        "text": "Cordant account status as of May 5: enterprise trial started, POC contract under review.",
        "source": "accounts/cordant-may-update.md",
        "timestamp_iso": "2026-05-05T11:00:00Z",
        "scope": {
          "tenantId": "benchmark-tenant",
          "userId": "benchmark-user",
          "agentId": "benchmark-agent",
          "spaceId": "benchmark-space",
          "label": {
            "visibility": "internal",
            "policy": "agent_visible",
            "domain": "benchmark",
            "sensitivity": null
          },
          "purpose": "memory_search",
          "beliefStage": "silver_candidate_claim"
        }
      }
    ],
    "question": "What is the current status of the Cordant account?",
    "expected_answer": "Enterprise trial started, POC contract under review.",
    "evidence_spans": [
      "mem-008"
    ],
    "temporal_metadata": {
      "reference_time_iso": "2026-05-05T23:59:00Z",
      "temporal_direction": "latest"
    },
    "license": "MIT",
    "citation": "MemroOS internal synthetic benchmark"
  },
  {
    "id": "memroos-pub-0006",
    "dataset": "memroos_public_synthetic",
    "task_type": "event_summary",
    "corpus": [
      {
        "id": "mem-009",
        "text": "May 27 call with Juan Spark (Cordant): Discussed AI-ops use case, data governance requirements, and timeline for a 3-month POC. Next step: send architecture overview.",
        "source": "calls/2026-05-27-cordant-juan-spark.md",
        "timestamp_iso": "2026-05-27T16:00:00Z",
        "scope": {
          "tenantId": "benchmark-tenant",
          "userId": "benchmark-user",
          "agentId": "benchmark-agent",
          "spaceId": "benchmark-space",
          "label": {
            "visibility": "internal",
            "policy": "agent_visible",
            "domain": "benchmark",
            "sensitivity": null
          },
          "purpose": "memory_search",
          "beliefStage": "silver_candidate_claim"
        }
      }
    ],
    "question": "What were the key outcomes of the May 27 Cordant call?",
    "expected_answer": "Discussed AI-ops use case, data governance requirements, and 3-month POC timeline. Next step: send architecture overview.",
    "evidence_spans": [
      "mem-009"
    ],
    "license": "MIT",
    "citation": "MemroOS internal synthetic benchmark"
  },
  {
    "id": "memroos-pub-0007",
    "dataset": "memroos_public_synthetic",
    "task_type": "single_hop",
    "corpus": [
      {
        "id": "mem-010",
        "text": "SkillForge evaluation uses a deterministic sandbox scorer. The sandbox denies all tool calls by default and records them in an evidence bundle.",
        "source": "docs/skillforge-eval.md",
        "timestamp_iso": "2026-06-01T09:00:00Z",
        "scope": {
          "tenantId": "benchmark-tenant",
          "userId": "benchmark-user",
          "agentId": "benchmark-agent",
          "spaceId": "benchmark-space",
          "label": {
            "visibility": "internal",
            "policy": "agent_visible",